{
  "runId": "30649925317",
  "commit": "6df3fba7c347dd2738a9b1f6f54450d891b41729",
  "timestamp": "2026-07-31T17:12:02.950Z",
  "workflowDurationMs": 186338,
  "catalogVersion": "1.0.0",
  "gatesVersion": "1.0.0",
  "assertionCountMethod": "static-expect-calls",
  "environment": {
    "ci": true,
    "workflow": "Quality Attributes Pipeline",
    "ref": "refs/heads/feature/quality-attributes-pipeline",
    "node": "v22.23.1"
  },
  "gates": [
    {
      "gateId": "typescript-check",
      "attributeId": "processing",
      "blocking": true,
      "status": "passed",
      "testsRun": 1,
      "testsPassed": 1,
      "assertions": 0,
      "durationMs": 5276,
      "logExcerpt": "Command 'npx --no-install tsc --noEmit' exited 0.",
      "artifacts": [
        "quality/evidence/raw/30649925317/typescript-check.log"
      ]
    },
    {
      "gateId": "spatial-operations-tests",
      "attributeId": "processing",
      "blocking": true,
      "status": "passed",
      "testsRun": 28,
      "testsPassed": 28,
      "assertions": 47,
      "durationMs": 21,
      "logExcerpt": "28/28 test cases passed across 3 file(s).",
      "artifacts": [
        "quality/evidence/raw/30649925317/vitest-results.json"
      ]
    },
    {
      "gateId": "h3-boundary-tests",
      "attributeId": "data-quality",
      "blocking": true,
      "status": "passed",
      "testsRun": 12,
      "testsPassed": 12,
      "assertions": 26,
      "durationMs": 25007,
      "logExcerpt": "12/12 test cases passed across 2 file(s).",
      "artifacts": [
        "quality/evidence/raw/30649925317/vitest-results.json"
      ]
    },
    {
      "gateId": "external-service-client-tests",
      "attributeId": "interoperability",
      "blocking": true,
      "status": "passed",
      "testsRun": 7,
      "testsPassed": 7,
      "assertions": 19,
      "durationMs": 7,
      "logExcerpt": "7/7 test cases passed across 1 file(s).",
      "artifacts": [
        "quality/evidence/raw/30649925317/vitest-results.json"
      ]
    },
    {
      "gateId": "spatial-data-cache-tests",
      "attributeId": "availability",
      "blocking": true,
      "status": "passed",
      "testsRun": 3,
      "testsPassed": 3,
      "assertions": 3,
      "durationMs": 11,
      "logExcerpt": "3/3 test cases passed across 1 file(s).",
      "artifacts": [
        "quality/evidence/raw/30649925317/vitest-results.json"
      ]
    },
    {
      "gateId": "health-route-test",
      "attributeId": "availability",
      "blocking": true,
      "status": "passed",
      "testsRun": 2,
      "testsPassed": 2,
      "assertions": 5,
      "durationMs": 6,
      "logExcerpt": "2/2 test cases passed across 1 file(s).",
      "artifacts": [
        "quality/evidence/raw/30649925317/vitest-results.json"
      ]
    },
    {
      "gateId": "auth-rbac-tests",
      "attributeId": "security",
      "blocking": true,
      "status": "passed",
      "testsRun": 93,
      "testsPassed": 93,
      "assertions": 188,
      "durationMs": 558,
      "logExcerpt": "93/93 test cases passed across 12 file(s).",
      "artifacts": [
        "quality/evidence/raw/30649925317/vitest-results.json"
      ]
    },
    {
      "gateId": "dependency-audit",
      "attributeId": "security",
      "blocking": false,
      "status": "passed",
      "testsRun": 1,
      "testsPassed": 1,
      "assertions": 0,
      "durationMs": 1161,
      "logExcerpt": "npm audit: 2 critical, 6 high, 5 moderate, 0 low (13 total advisories).",
      "artifacts": [
        "quality/evidence/raw/30649925317/npm-audit.json"
      ]
    },
    {
      "gateId": "ui-component-tests",
      "attributeId": "usability-geospatial",
      "blocking": true,
      "status": "passed",
      "testsRun": 185,
      "testsPassed": 185,
      "assertions": 314,
      "durationMs": 4936,
      "logExcerpt": "185/185 test cases passed across 39 file(s).",
      "artifacts": [
        "quality/evidence/raw/30649925317/vitest-results.json"
      ]
    },
    {
      "gateId": "accessibility-tests",
      "attributeId": "usability-geospatial",
      "blocking": true,
      "status": "passed",
      "testsRun": 3,
      "testsPassed": 3,
      "assertions": 2,
      "durationMs": 42495,
      "logExcerpt": "3 Playwright test(s) passed.",
      "artifacts": [
        "quality/evidence/raw/30649925317/accessibility-tests.log"
      ]
    },
    {
      "gateId": "map-render-performance",
      "attributeId": "performance",
      "blocking": true,
      "status": "passed",
      "testsRun": 4,
      "testsPassed": 4,
      "assertions": 6,
      "durationMs": 34151,
      "logExcerpt": "4 Playwright test(s) passed.",
      "artifacts": [
        "quality/evidence/raw/30649925317/map-render-performance.log"
      ]
    },
    {
      "gateId": "production-build",
      "attributeId": "availability",
      "blocking": true,
      "status": "passed",
      "testsRun": 1,
      "testsPassed": 1,
      "assertions": 0,
      "durationMs": 22369,
      "logExcerpt": "Command 'npm run build' exited 0.",
      "artifacts": [
        "quality/evidence/raw/30649925317/production-build.log"
      ]
    }
  ],
  "coverage": {
    "lines": 61.67,
    "branches": 52.64
  },
  "audit": {
    "critical": 2,
    "high": 6,
    "moderate": 5,
    "low": 0
  },
  "attributeCoverage": {
    "totalAttributes": 13,
    "strongCoverageMinRatio": 0.5,
    "covered": [
      "processing",
      "availability",
      "performance",
      "security",
      "data-quality",
      "interoperability",
      "usability-geospatial"
    ],
    "uncovered": [
      "data-integration",
      "result-quality",
      "scalability",
      "traceability-auditability",
      "resilience",
      "geoethics"
    ],
    "stronglyCovered": [
      "processing",
      "security",
      "data-quality",
      "usability-geospatial"
    ],
    "weaklyCovered": [
      "availability",
      "performance",
      "interoperability"
    ],
    "perAttribute": [
      {
        "attributeId": "processing",
        "name": "Processing",
        "status": "covered",
        "gateIds": [
          "typescript-check",
          "spatial-operations-tests"
        ],
        "implementedTests": [
          "geometric precision tests",
          "spatial unit tests (vector/raster)"
        ],
        "missingTests": [
          "CRS consistency tests",
          "reproducibility tests"
        ],
        "catalogTestCount": 4,
        "implementedTestRatio": 0.5
      },
      {
        "attributeId": "availability",
        "name": "Availability",
        "status": "weak",
        "gateIds": [
          "spatial-data-cache-tests",
          "health-route-test",
          "production-build"
        ],
        "implementedTests": [],
        "missingTests": [
          "connectivity tests to data sources",
          "fault tolerance tests",
          "GIS service recovery tests"
        ],
        "catalogTestCount": 3,
        "implementedTestRatio": 0
      },
      {
        "attributeId": "data-integration",
        "name": "Data Integration",
        "status": "uncovered",
        "gateIds": [],
        "implementedTests": [],
        "missingTests": [
          "vector-raster compatibility",
          "multi-source integration",
          "metadata validation",
          "semantic consistency"
        ],
        "catalogTestCount": 4,
        "implementedTestRatio": 0
      },
      {
        "attributeId": "performance",
        "name": "Performance",
        "status": "weak",
        "gateIds": [
          "map-render-performance"
        ],
        "implementedTests": [
          "map rendering"
        ],
        "missingTests": [
          "layer loading time",
          "spatial query latency"
        ],
        "catalogTestCount": 3,
        "implementedTestRatio": 0.3333
      },
      {
        "attributeId": "result-quality",
        "name": "Result Quality",
        "status": "uncovered",
        "gateIds": [],
        "implementedTests": [],
        "missingTests": [
          "validation against reference data",
          "topological consistency",
          "uncertainty analysis"
        ],
        "catalogTestCount": 3,
        "implementedTestRatio": 0
      },
      {
        "attributeId": "security",
        "name": "Security",
        "status": "covered",
        "gateIds": [
          "auth-rbac-tests",
          "dependency-audit"
        ],
        "implementedTests": [
          "GIS API security",
          "layer access control protection",
          "sensitive data"
        ],
        "missingTests": [
          "spatial integrity"
        ],
        "catalogTestCount": 4,
        "implementedTestRatio": 0.75
      },
      {
        "attributeId": "data-quality",
        "name": "Data Quality",
        "status": "covered",
        "gateIds": [
          "h3-boundary-tests"
        ],
        "implementedTests": [
          "metadata validation",
          "positional accuracy tests",
          "spatial completeness tests"
        ],
        "missingTests": [
          "temporal consistency tests"
        ],
        "catalogTestCount": 4,
        "implementedTestRatio": 0.75
      },
      {
        "attributeId": "scalability",
        "name": "Scalability",
        "status": "uncovered",
        "gateIds": [],
        "implementedTests": [],
        "missingTests": [
          "load tests with increasing datasets",
          "resolution increase tests (raster)",
          "concurrent user tests",
          "horizontal/vertical scaling tests"
        ],
        "catalogTestCount": 4,
        "implementedTestRatio": 0
      },
      {
        "attributeId": "interoperability",
        "name": "Interoperability",
        "status": "weak",
        "gateIds": [
          "external-service-client-tests"
        ],
        "implementedTests": [
          "integration with external systems"
        ],
        "missingTests": [
          "OGC services testing",